[ 2025-12-12 19:29:52,761 ] 14 visions.backends - INFO - Pandas backend loaded 2.3.3
[ 2025-12-12 19:29:52,770 ] 25 visions.backends - INFO - Numpy backend loaded 2.3.5
[ 2025-12-12 19:29:52,770 ] 37 visions.backends - INFO - Pyspark backend NOT loaded
[ 2025-12-12 19:29:52,770 ] 43 visions.backends - INFO - Python backend loaded
[ 2025-12-12 19:30:13,972 ] 27 root - INFO - Entered the data ingestion method or component
[ 2025-12-12 19:30:13,972 ] 29 root - INFO - Read the Dataset as dataframe
[ 2025-12-12 19:30:13,980 ] 35 root - INFO - Train test split initiated
[ 2025-12-12 19:30:13,989 ] 41 root - INFO - Ingestion of the data is completed
[ 2025-12-12 19:30:20,647 ] 67 root - INFO - Train data shape: (820, 14)
[ 2025-12-12 19:30:20,647 ] 68 root - INFO - Train data columns: ['age', 'sex', 'cp', 'trestbps', 'chol', 'fbs', 'restecg', 'thalach', 'exang', 'oldpeak', 'slope', 'ca', 'thal', 'target']
[ 2025-12-12 19:30:21,146 ] 74 root - INFO - Test data shape: (296, 3)
[ 2025-12-12 19:30:21,146 ] 75 root - INFO - Test data columns: ['<!doctype html><html lang=en><meta charset=utf-8><meta content="width=device-width', 'initial-scale=1', 'shrink-to-fit=no" name=viewport><meta content="Profile report generated by YData! Visit us at https://ydata.ai" name=description><meta content="YData and the open source community." name=author><meta content="YData Profiling vv4.18.0" name=generator><meta content=https://github.com/ydataai/ydata-profiling name=url><meta content="2025-12-12 14:30:15.493698" name=date><title>Exploratory Data Analysis Report</title><style>@charset "UTF-8";/*!']
[ 2025-12-12 19:30:21,146 ] 77 root - INFO - Read train and test data completed
[ 2025-12-12 19:30:21,147 ] 89 root - INFO - Obtaining preprocessing object
[ 2025-12-12 19:30:21,147 ] 46 root - INFO - Categorical columns: []
[ 2025-12-12 19:30:21,147 ] 47 root - INFO - Numerical columns: ['age', 'sex', 'cp', 'trestbps', 'chol', 'fbs', 'restecg', 'thalach', 'exang', 'oldpeak', 'slope', 'ca', 'thal']
[ 2025-12-12 19:30:21,148 ] 62 root - ERROR - Error: Error occured in python script name [C:\Users\AsawerAyesha\Desktop\Projects\AutoML\AutoML_Project\src\components\data_transformation.py] line number [99] error message["['target'] not found in axis"]
[ 2025-12-12 19:31:46,703 ] 27 root - INFO - Entered the data ingestion method or component
[ 2025-12-12 19:31:46,703 ] 29 root - INFO - Read the Dataset as dataframe
[ 2025-12-12 19:31:46,709 ] 35 root - INFO - Train test split initiated
[ 2025-12-12 19:31:46,718 ] 41 root - INFO - Ingestion of the data is completed
[ 2025-12-12 19:31:52,785 ] 67 root - INFO - Train data shape: (820, 14)
[ 2025-12-12 19:31:52,785 ] 68 root - INFO - Train data columns: ['age', 'sex', 'cp', 'trestbps', 'chol', 'fbs', 'restecg', 'thalach', 'exang', 'oldpeak', 'slope', 'ca', 'thal', 'target']
[ 2025-12-12 19:31:52,788 ] 74 root - INFO - Test data shape: (205, 14)
[ 2025-12-12 19:31:52,788 ] 75 root - INFO - Test data columns: ['age', 'sex', 'cp', 'trestbps', 'chol', 'fbs', 'restecg', 'thalach', 'exang', 'oldpeak', 'slope', 'ca', 'thal', 'target']
[ 2025-12-12 19:31:52,790 ] 77 root - INFO - Read train and test data completed
[ 2025-12-12 19:31:52,790 ] 89 root - INFO - Obtaining preprocessing object
[ 2025-12-12 19:31:52,790 ] 46 root - INFO - Categorical columns: []
[ 2025-12-12 19:31:52,790 ] 47 root - INFO - Numerical columns: ['age', 'sex', 'cp', 'trestbps', 'chol', 'fbs', 'restecg', 'thalach', 'exang', 'oldpeak', 'slope', 'ca', 'thal']
[ 2025-12-12 19:31:52,790 ] 102 root - INFO - Applying preprocessing object on training and testing dataframes.
[ 2025-12-12 19:31:52,799 ] 129 root - INFO - Saved preprocessing object.
[ 2025-12-12 19:31:52,801 ] 32 root - INFO - Split training and test input data
[ 2025-12-12 19:31:58,249 ] 39 root - INFO - Best model params for Random Forest: {'n_estimators': 128}
[ 2025-12-12 19:31:58,274 ] 49 root - INFO - Random Forest - Train Score: 1.0, Test Score: 0.9853658536585366
[ 2025-12-12 19:31:58,303 ] 39 root - INFO - Best model params for Decision Tree: {'criterion': 'gini'}
[ 2025-12-12 19:31:58,305 ] 49 root - INFO - Decision Tree - Train Score: 1.0, Test Score: 0.9853658536585366
[ 2025-12-12 19:31:58,311 ] 49 root - INFO - Logistic Regression - Train Score: 0.8719512195121951, Test Score: 0.7951219512195122
[ 2025-12-12 19:32:00,536 ] 39 root - INFO - Best model params for AdaBoost Classifier: {'learning_rate': 0.5, 'n_estimators': 256}
[ 2025-12-12 19:32:00,598 ] 49 root - INFO - AdaBoost Classifier - Train Score: 0.9097560975609756, Test Score: 0.8292682926829268
[ 2025-12-12 19:52:29,918 ] 27 root - INFO - Entered the data ingestion method or component
[ 2025-12-12 19:52:29,918 ] 29 root - INFO - Read the Dataset as dataframe
[ 2025-12-12 19:52:29,924 ] 35 root - INFO - Train test split initiated
[ 2025-12-12 19:52:29,931 ] 41 root - INFO - Ingestion of the data is completed
[ 2025-12-12 19:52:36,292 ] 82 root - INFO - Train data shape: (820, 14)
[ 2025-12-12 19:52:36,292 ] 83 root - INFO - Train data columns: ['age', 'sex', 'cp', 'trestbps', 'chol', 'fbs', 'restecg', 'thalach', 'exang', 'oldpeak', 'slope', 'ca', 'thal', 'target']
[ 2025-12-12 19:52:36,296 ] 89 root - INFO - Test data shape: (205, 14)
[ 2025-12-12 19:52:36,296 ] 90 root - INFO - Test data columns: ['age', 'sex', 'cp', 'trestbps', 'chol', 'fbs', 'restecg', 'thalach', 'exang', 'oldpeak', 'slope', 'ca', 'thal', 'target']
[ 2025-12-12 19:52:36,296 ] 92 root - INFO - Read train and test data completed
[ 2025-12-12 19:52:36,297 ] 62 root - ERROR - Error: Error occured in python script name [C:\Users\AsawerAyesha\Desktop\Projects\AutoML\AutoML_Project\src\components\data_transformation.py] line number [95] error message['DataTransformation' object has no attribute 'get_data_metadata']
[ 2025-12-12 19:58:56,399 ] 27 root - INFO - Entered the data ingestion method or component
[ 2025-12-12 19:58:56,399 ] 29 root - INFO - Read the Dataset as dataframe
[ 2025-12-12 19:58:56,405 ] 35 root - INFO - Train test split initiated
[ 2025-12-12 19:58:56,413 ] 41 root - INFO - Ingestion of the data is completed
[ 2025-12-12 19:59:09,856 ] 62 root - ERROR - Error: Error occured in python script name [C:\Users\AsawerAyesha\Desktop\Projects\AutoML\AutoML_Project\src\components\data_transformation.py] line number [59] error message['str' object has no attribute 'columns']
[ 2025-12-12 19:59:44,058 ] 27 root - INFO - Entered the data ingestion method or component
[ 2025-12-12 19:59:44,058 ] 29 root - INFO - Read the Dataset as dataframe
[ 2025-12-12 19:59:44,063 ] 35 root - INFO - Train test split initiated
[ 2025-12-12 19:59:44,071 ] 41 root - INFO - Ingestion of the data is completed
[ 2025-12-12 19:59:50,038 ] 68 root - INFO - Train data shape: (820, 14)
[ 2025-12-12 19:59:50,038 ] 69 root - INFO - Train data columns: ['age', 'sex', 'cp', 'trestbps', 'chol', 'fbs', 'restecg', 'thalach', 'exang', 'oldpeak', 'slope', 'ca', 'thal', 'target']
[ 2025-12-12 19:59:50,040 ] 75 root - INFO - Test data shape: (205, 14)
[ 2025-12-12 19:59:50,040 ] 76 root - INFO - Test data columns: ['age', 'sex', 'cp', 'trestbps', 'chol', 'fbs', 'restecg', 'thalach', 'exang', 'oldpeak', 'slope', 'ca', 'thal', 'target']
[ 2025-12-12 19:59:50,040 ] 78 root - INFO - Read train and test data completed
[ 2025-12-12 19:59:50,041 ] 90 root - INFO - Obtaining preprocessing object
[ 2025-12-12 19:59:50,041 ] 46 root - INFO - Categorical columns: []
[ 2025-12-12 19:59:50,041 ] 47 root - INFO - Numerical columns: ['age', 'sex', 'cp', 'trestbps', 'chol', 'fbs', 'restecg', 'thalach', 'exang', 'oldpeak', 'slope', 'ca', 'thal']
[ 2025-12-12 19:59:50,041 ] 103 root - INFO - Applying preprocessing object on training and testing dataframes.
[ 2025-12-12 19:59:50,049 ] 130 root - INFO - Saved preprocessing object.
[ 2025-12-12 19:59:50,051 ] 32 root - INFO - Split training and test input data
[ 2025-12-12 19:59:55,142 ] 39 root - INFO - Best model params for Random Forest: {'n_estimators': 64}
[ 2025-12-12 19:59:55,157 ] 49 root - INFO - Random Forest - Train Score: 1.0, Test Score: 0.9853658536585366
[ 2025-12-12 19:59:55,174 ] 39 root - INFO - Best model params for Decision Tree: {'criterion': 'gini'}
[ 2025-12-12 19:59:55,176 ] 49 root - INFO - Decision Tree - Train Score: 1.0, Test Score: 0.9853658536585366
[ 2025-12-12 19:59:55,179 ] 49 root - INFO - Logistic Regression - Train Score: 0.8719512195121951, Test Score: 0.7951219512195122
[ 2025-12-12 19:59:57,498 ] 39 root - INFO - Best model params for AdaBoost Classifier: {'learning_rate': 0.5, 'n_estimators': 256}
[ 2025-12-12 19:59:57,545 ] 49 root - INFO - AdaBoost Classifier - Train Score: 0.9097560975609756, Test Score: 0.8292682926829268
