[ 2025-12-19 20:54:36,510 ] 14 visions.backends - INFO - Pandas backend loaded 2.3.3
[ 2025-12-19 20:54:36,592 ] 25 visions.backends - INFO - Numpy backend loaded 2.3.5
[ 2025-12-19 20:54:36,593 ] 37 visions.backends - INFO - Pyspark backend NOT loaded
[ 2025-12-19 20:54:36,594 ] 43 visions.backends - INFO - Python backend loaded
[ 2025-12-19 21:16:14,513 ] 27 root - INFO - Entered the data ingestion method or component
[ 2025-12-19 21:16:14,514 ] 29 root - INFO - Read the Dataset as dataframe
[ 2025-12-19 21:16:14,547 ] 35 root - INFO - Train test split initiated
[ 2025-12-19 21:16:14,575 ] 41 root - INFO - Ingestion of the data is completed
[ 2025-12-19 21:16:45,670 ] 104 root - INFO - Train data shape: (820, 14)
[ 2025-12-19 21:16:45,671 ] 105 root - INFO - Train data columns: ['age', 'sex', 'cp', 'trestbps', 'chol', 'fbs', 'restecg', 'thalach', 'exang', 'oldpeak', 'slope', 'ca', 'thal', 'target']
[ 2025-12-19 21:16:45,681 ] 111 root - INFO - Test data shape: (205, 14)
[ 2025-12-19 21:16:45,682 ] 112 root - INFO - Test data columns: ['age', 'sex', 'cp', 'trestbps', 'chol', 'fbs', 'restecg', 'thalach', 'exang', 'oldpeak', 'slope', 'ca', 'thal', 'target']
[ 2025-12-19 21:16:45,682 ] 114 root - INFO - Read train and test data completed
[ 2025-12-19 21:16:45,683 ] 126 root - INFO - Obtaining preprocessing object
[ 2025-12-19 21:16:45,684 ] 81 root - INFO - Categorical columns: []
[ 2025-12-19 21:16:45,684 ] 82 root - INFO - Numerical columns: ['age', 'sex', 'cp', 'trestbps', 'chol', 'fbs', 'restecg', 'thalach', 'exang', 'oldpeak', 'slope', 'ca', 'thal']
[ 2025-12-19 21:16:45,689 ] 139 root - INFO - Applying preprocessing object on training and testing dataframes.
[ 2025-12-19 21:16:45,728 ] 166 root - INFO - Saved preprocessing object.
[ 2025-12-19 21:16:59,820 ] 38 root - INFO - Split training and test input data
[ 2025-12-19 21:17:37,250 ] 89 root - INFO - GridSearchCV - Best model params for Random Forest: {'n_estimators': 16}
[ 2025-12-19 21:17:37,355 ] 133 root - INFO - Random Forest - Accuracy: 0.9854, Precision: 1.0000, Recall: 0.9709, F1: 0.9852, Time: 37.43s
[ 2025-12-19 21:17:37,496 ] 89 root - INFO - GridSearchCV - Best model params for Decision Tree: {'criterion': 'gini'}
[ 2025-12-19 21:17:37,673 ] 133 root - INFO - Decision Tree - Accuracy: 0.9854, Precision: 1.0000, Recall: 0.9709, F1: 0.9852, Time: 0.14s
[ 2025-12-19 21:17:37,926 ] 133 root - INFO - Logistic Regression - Accuracy: 0.7951, Precision: 0.7563, Recall: 0.8738, F1: 0.8108, Time: 0.13s
[ 2025-12-19 21:18:08,439 ] 89 root - INFO - GridSearchCV - Best model params for AdaBoost Classifier: {'learning_rate': 0.5, 'n_estimators': 256}
[ 2025-12-19 21:18:08,914 ] 133 root - INFO - AdaBoost Classifier - Accuracy: 0.8293, Precision: 0.7982, Recall: 0.8835, F1: 0.8387, Time: 30.51s
[ 2025-12-19 21:18:10,122 ] 89 root - INFO - GridSearchCV - Best model params for K-Nearest Neighbors: {'metric': 'euclidean', 'n_neighbors': 3}
[ 2025-12-19 21:18:10,214 ] 133 root - INFO - K-Nearest Neighbors - Accuracy: 0.9366, Precision: 0.9245, Recall: 0.9515, F1: 0.9378, Time: 1.21s
[ 2025-12-19 21:18:10,265 ] 133 root - INFO - Naive Bayes - Accuracy: 0.8000, Precision: 0.7541, Recall: 0.8932, F1: 0.8178, Time: 0.01s
[ 2025-12-19 21:18:30,826 ] 89 root - INFO - GridSearchCV - Best model params for Support Vector Machine: {'C': 100, 'kernel': 'rbf'}
[ 2025-12-19 21:18:30,936 ] 133 root - INFO - Support Vector Machine - Accuracy: 0.9854, Precision: 1.0000, Recall: 0.9709, F1: 0.9852, Time: 20.56s
[ 2025-12-19 21:18:31,030 ] 119 root - WARNING - OneR Classifier does not support probability predictions for ROC-AUC
[ 2025-12-19 21:18:31,030 ] 133 root - INFO - OneR Classifier - Accuracy: 0.7220, Precision: 0.7614, Recall: 0.6505, F1: 0.7016, Time: 0.06s
[ 2025-12-19 21:18:31,032 ] 96 root - INFO - Best found model: Random Forest
[ 2025-12-19 21:38:51,425 ] 27 root - INFO - Entered the data ingestion method or component
[ 2025-12-19 21:38:51,427 ] 29 root - INFO - Read the Dataset as dataframe
[ 2025-12-19 21:38:51,439 ] 35 root - INFO - Train test split initiated
[ 2025-12-19 21:38:51,470 ] 41 root - INFO - Ingestion of the data is completed
[ 2025-12-19 21:39:19,712 ] 104 root - INFO - Train data shape: (820, 14)
[ 2025-12-19 21:39:19,712 ] 105 root - INFO - Train data columns: ['age', 'sex', 'cp', 'trestbps', 'chol', 'fbs', 'restecg', 'thalach', 'exang', 'oldpeak', 'slope', 'ca', 'thal', 'target']
[ 2025-12-19 21:39:19,722 ] 111 root - INFO - Test data shape: (205, 14)
[ 2025-12-19 21:39:19,723 ] 112 root - INFO - Test data columns: ['age', 'sex', 'cp', 'trestbps', 'chol', 'fbs', 'restecg', 'thalach', 'exang', 'oldpeak', 'slope', 'ca', 'thal', 'target']
[ 2025-12-19 21:39:19,725 ] 114 root - INFO - Read train and test data completed
[ 2025-12-19 21:39:19,727 ] 126 root - INFO - Obtaining preprocessing object
[ 2025-12-19 21:39:19,727 ] 81 root - INFO - Categorical columns: []
[ 2025-12-19 21:39:19,728 ] 82 root - INFO - Numerical columns: ['age', 'sex', 'cp', 'trestbps', 'chol', 'fbs', 'restecg', 'thalach', 'exang', 'oldpeak', 'slope', 'ca', 'thal']
[ 2025-12-19 21:39:19,736 ] 139 root - INFO - Applying preprocessing object on training and testing dataframes.
[ 2025-12-19 21:39:19,775 ] 166 root - INFO - Saved preprocessing object.
[ 2025-12-19 21:39:38,212 ] 38 root - INFO - Split training and test input data
[ 2025-12-19 21:40:11,151 ] 89 root - INFO - GridSearchCV - Best model params for Random Forest: {'n_estimators': 64}
[ 2025-12-19 21:40:11,342 ] 133 root - INFO - Random Forest - Accuracy: 0.9854, Precision: 1.0000, Recall: 0.9709, F1: 0.9852, Time: 32.94s
[ 2025-12-19 21:40:11,562 ] 89 root - INFO - GridSearchCV - Best model params for Decision Tree: {'criterion': 'gini'}
[ 2025-12-19 21:40:11,860 ] 133 root - INFO - Decision Tree - Accuracy: 0.9854, Precision: 1.0000, Recall: 0.9709, F1: 0.9852, Time: 0.22s
[ 2025-12-19 21:40:12,773 ] 133 root - INFO - Logistic Regression - Accuracy: 0.7951, Precision: 0.7563, Recall: 0.8738, F1: 0.8108, Time: 0.34s
[ 2025-12-19 21:40:47,349 ] 89 root - INFO - GridSearchCV - Best model params for AdaBoost Classifier: {'learning_rate': 0.5, 'n_estimators': 256}
[ 2025-12-19 21:40:48,090 ] 133 root - INFO - AdaBoost Classifier - Accuracy: 0.8293, Precision: 0.7982, Recall: 0.8835, F1: 0.8387, Time: 34.58s
[ 2025-12-19 21:40:49,536 ] 89 root - INFO - GridSearchCV - Best model params for K-Nearest Neighbors: {'metric': 'euclidean', 'n_neighbors': 3}
[ 2025-12-19 21:40:49,651 ] 133 root - INFO - K-Nearest Neighbors - Accuracy: 0.9366, Precision: 0.9245, Recall: 0.9515, F1: 0.9378, Time: 1.45s
[ 2025-12-19 21:40:49,706 ] 133 root - INFO - Naive Bayes - Accuracy: 0.8000, Precision: 0.7541, Recall: 0.8932, F1: 0.8178, Time: 0.01s
[ 2025-12-19 21:41:09,294 ] 89 root - INFO - GridSearchCV - Best model params for Support Vector Machine: {'C': 100, 'kernel': 'rbf'}
[ 2025-12-19 21:41:09,428 ] 133 root - INFO - Support Vector Machine - Accuracy: 0.9854, Precision: 1.0000, Recall: 0.9709, F1: 0.9852, Time: 19.59s
[ 2025-12-19 21:41:09,579 ] 119 root - WARNING - OneR Classifier does not support probability predictions for ROC-AUC
[ 2025-12-19 21:41:09,580 ] 133 root - INFO - OneR Classifier - Accuracy: 0.7220, Precision: 0.7614, Recall: 0.6505, F1: 0.7016, Time: 0.09s
[ 2025-12-19 21:41:09,584 ] 96 root - INFO - Best found model: Random Forest
[ 2025-12-19 21:41:14,243 ] 656 root - WARNING - Could not generate P-R curve for OneR Classifier: 'OneRClassifier' object has no attribute 'predict_proba'
